{
  "$schema": "../schemas/token-contracts.schema.json",
  "schema": "neosmartui/token-contracts@1",
  "schemaVersion": 1,
  "interopTarget": {"format": "DTCG", "version": "2025.10", "stage": "resolved-value-bundles"},
  "contracts": [
    {"id":"color.surface.canvas","type":"color","resolution":"theme","description":"Application canvas/background surface."},
    {"id":"color.surface.panel","type":"color","resolution":"theme","description":"Raised or grouped content surface."},
    {"id":"color.surface.interactive","type":"color","resolution":"theme","description":"Default interactive control surface."},
    {"id":"color.content.primary","type":"color","resolution":"theme","description":"Primary readable foreground content."},
    {"id":"color.content.secondary","type":"color","resolution":"theme","description":"Secondary readable foreground content."},
    {"id":"color.content.inverse","type":"color","resolution":"theme","description":"Foreground content used on inverse/high-contrast surfaces."},
    {"id":"color.border.default","type":"color","resolution":"theme","description":"Default structural border color."},
    {"id":"color.border.strong","type":"color","resolution":"theme","description":"Emphasized structural border color."},
    {"id":"color.action.primary.surface","type":"color","resolution":"theme","description":"Primary action surface color."},
    {"id":"color.action.primary.content","type":"color","resolution":"theme","description":"Primary action foreground color."},
    {"id":"color.focus.ring","type":"color","resolution":"theme","description":"Keyboard focus ring color."},
    {"id":"color.state.success","type":"color","resolution":"theme","description":"Success-state semantic color."},
    {"id":"color.state.warning","type":"color","resolution":"theme","description":"Warning-state semantic color."},
    {"id":"color.state.error","type":"color","resolution":"theme","description":"Error-state semantic color."},
    {"id":"color.state.info","type":"color","resolution":"theme","description":"Informational-state semantic color."},

    {"id":"space.control.inline","type":"dimension","resolution":"flavor-theme","description":"Inline padding/gap rhythm inside controls."},
    {"id":"space.control.block","type":"dimension","resolution":"flavor-theme","description":"Block-axis padding rhythm inside controls."},
    {"id":"space.surface.inline","type":"dimension","resolution":"flavor-theme","description":"Inline padding rhythm inside grouped content surfaces."},
    {"id":"space.surface.block","type":"dimension","resolution":"flavor-theme","description":"Block-axis padding rhythm inside grouped content surfaces."},
    {"id":"space.annotation.inline","type":"dimension","resolution":"flavor-theme","description":"Compact inline padding rhythm for informational annotation/status surfaces."},
    {"id":"space.annotation.block","type":"dimension","resolution":"flavor-theme","description":"Compact block-axis padding rhythm for informational annotation/status surfaces."},
    {"id":"space.layout.gutter","type":"dimension","resolution":"flavor-theme","description":"Primary responsive layout gutter."},
    {"id":"space.layout.section","type":"dimension","resolution":"flavor-theme","description":"Primary separation between major layout sections."},
    {"id":"size.control.minimum","type":"dimension","resolution":"flavor-theme","description":"Minimum interactive target dimension contract."},
    {"id":"border.control.width","type":"dimension","resolution":"flavor-theme","description":"Structural control border width."},
    {"id":"border.surface.width","type":"dimension","resolution":"flavor-theme","description":"Structural border width for grouped content surfaces."},
    {"id":"border.annotation.width","type":"dimension","resolution":"flavor-theme","description":"Structural border width for compact informational annotation/status surfaces."},
    {"id":"radius.control","type":"dimension","resolution":"flavor-theme","description":"Default control corner radius."},
    {"id":"radius.surface","type":"dimension","resolution":"flavor-theme","description":"Default grouped-surface corner radius."},
    {"id":"radius.annotation","type":"dimension","resolution":"flavor-theme","description":"Default corner radius for compact informational annotation/status surfaces."},
    {"id":"focus.ring.width","type":"dimension","resolution":"flavor-theme","description":"Keyboard focus ring width."},
    {"id":"focus.ring.offset","type":"dimension","resolution":"flavor-theme","description":"Keyboard focus ring offset."},

    {"id":"depth.rest.x","type":"dimension","resolution":"flavor-theme","description":"Horizontal structural depth at rest."},
    {"id":"depth.rest.y","type":"dimension","resolution":"flavor-theme","description":"Vertical structural depth at rest."},
    {"id":"depth.hover.x","type":"dimension","resolution":"flavor-theme","description":"Horizontal structural depth during hover/proximity compression."},
    {"id":"depth.hover.y","type":"dimension","resolution":"flavor-theme","description":"Vertical structural depth during hover/proximity compression."},
    {"id":"depth.active.x","type":"dimension","resolution":"flavor-theme","description":"Horizontal structural depth while pressed/seated."},
    {"id":"depth.active.y","type":"dimension","resolution":"flavor-theme","description":"Vertical structural depth while pressed/seated."},
    {"id":"press.hover.x","type":"dimension","resolution":"flavor-theme","description":"Horizontal control translation during hover/proximity compression."},
    {"id":"press.hover.y","type":"dimension","resolution":"flavor-theme","description":"Vertical control translation during hover/proximity compression."},
    {"id":"press.active.x","type":"dimension","resolution":"flavor-theme","description":"Horizontal control translation while pressed/seated."},
    {"id":"press.active.y","type":"dimension","resolution":"flavor-theme","description":"Vertical control translation while pressed/seated."},

    {"id":"motion.press.duration","type":"duration","resolution":"flavor-theme","description":"Immediate press acknowledgement duration."},
    {"id":"motion.release.duration","type":"duration","resolution":"flavor-theme","description":"Release/return feedback duration."},
    {"id":"motion.standard.duration","type":"duration","resolution":"flavor-theme","description":"Common state-transition duration."},
    {"id":"motion.structural.duration","type":"duration","resolution":"flavor-theme","description":"Larger structural transition duration."},
    {"id":"motion.press.easing","type":"cubicBezier","resolution":"flavor-theme","description":"Press/compression easing role."},
    {"id":"motion.release.easing","type":"cubicBezier","resolution":"flavor-theme","description":"Release/return easing role."},
    {"id":"motion.standard.easing","type":"cubicBezier","resolution":"flavor-theme","description":"Default non-physical state-transition easing role."},
    {"id":"motion.feedback.intensity","type":"number","resolution":"flavor-theme","description":"Relative tactile feedback intensity."},
    {"id":"motion.rebound.intensity","type":"number","resolution":"flavor-theme","description":"Relative release rebound/overshoot intensity."},

    {"id":"font.family.body","type":"fontFamily","resolution":"theme","description":"Primary body/interface font family."},
    {"id":"font.family.display","type":"fontFamily","resolution":"theme","description":"Display/expressive font family."},
    {"id":"font.size.body","type":"dimension","resolution":"theme","description":"Primary body text size."},
    {"id":"font.size.label","type":"dimension","resolution":"theme","description":"Primary control/label text size."},
    {"id":"font.size.display","type":"dimension","resolution":"theme","description":"Primary display text size."},
    {"id":"font.weight.regular","type":"fontWeight","resolution":"theme","description":"Regular text emphasis weight."},
    {"id":"font.weight.emphasis","type":"fontWeight","resolution":"theme","description":"Intermediate emphasis weight."},
    {"id":"font.weight.strong","type":"fontWeight","resolution":"theme","description":"Strong emphasis weight."},
    {"id":"opacity.disabled","type":"number","resolution":"flavor-theme","description":"Disabled-state opacity role where opacity is used."}
  ]
}
